{
  "updated_at": "2026-07-30T17:54:02Z",
  "base_url": "https://raw.githubusercontent.com/blackaft/burnoutseries/dev/.agents/vaults/imgs/",
  "count": 17,
  "items": [
    "4-project-phases-1-intent-featured.webp",
    "a-plot-twist-at-the-storys-core-featured.png",
    "audio-now-available-featured.png"
  ]
}
